cluster_id,n_docs,top_terms
6,196,soil; use; land; land use; plant; intensity; an; grassland; biodiversity; exploratories
4,70,effects; use; land; land use; vegetation; grassland; all; exploratories; dataset; eps
2,37,soil; grassland; community; the data; community composition; composition; dataset; we; specific; can be
1,28,effects; diversity and; was; study; of forest; biodiversity; plant; the data; exploratories; tree
5,22,fungal; tree; diversity and; dün; hainich dün; forests; the data; study; community; was
3,22,plant; soil; all; on all; fungal; community; community composition; composition; land; within
0,21,alb; vegetation; of forest; data of; eps; exploratories; 2017; 150; all forest; abundance
7,20,soil; fungal; diversity and; community; composition; community composition; also; on all; within; all
